[
  {
    "id": "faq-split-accordion",
    "title": "FAQ split accordion",
    "family": "faq",
    "description": "An introduction and support action beside an interactive accordion.",
    "selection": {
      "description": "Use when frequently asked questions need context, reassurance, and a nearby escalation path.",
      "queries": ["Add an FAQ beside introductory copy", "Create a support-oriented accordion section"],
      "avoidWhen": ["There are fewer than three questions or every answer must remain visible."],
      "keywords": ["faq", "accordion", "questions", "support", "split"]
    },
    "anatomy": [
      { "id": "intro", "label": "Introductory copy", "kind": "content", "required": true },
      { "id": "questions", "label": "Question accordion", "kind": "list", "required": true },
      { "id": "support-action", "label": "Support action", "kind": "action", "required": false }
    ],
    "components": ["section", "accordion", "button-link"],
    "client": true,
    "responsive": {
      "compact": "Stack the introduction before the full-width accordion.",
      "wide": "Place the introduction and accordion in asymmetric columns."
    },
    "accessibilityChecks": ["section-heading", "accordion-keyboard-operation", "visible-focus"],
    "neighbors": {
      "before": ["process-numbered-steps", "services-media-grid"],
      "after": ["newsletter-inline-band", "confirmation-next-actions"]
    },
    "template": {
      "component": "FAQSplitAccordion",
      "source": "templates/compositions/FAQSplitAccordion.jsx",
      "style": "templates/compositions/compositions.module.css"
    },
    "evidence": ["bgr-main", "heatwave-fl", "Precision-paint-pros", "virtuecreation"],
    "stability": "experimental",
    "since": "0.6.0",
    "contractVersion": 1
  },
  {
    "id": "faq-stacked-list",
    "title": "FAQ stacked list",
    "family": "faq",
    "description": "A heading followed by an always-visible semantic question-and-answer list.",
    "selection": {
      "description": "Use when answers are short, highly scannable, and useful to compare without interaction.",
      "queries": ["Show all FAQs in a simple list", "Create a compact questions and answers section"],
      "avoidWhen": ["Answers are long enough to make the page difficult to scan."],
      "keywords": ["faq", "questions", "answers", "stacked", "support"]
    },
    "anatomy": [
      { "id": "intro", "label": "Section heading", "kind": "content", "required": true },
      { "id": "answers", "label": "Question and answer list", "kind": "list", "required": true }
    ],
    "components": ["section"],
    "client": false,
    "responsive": {
      "compact": "Keep each answer in a single stacked reading flow.",
      "wide": "Retain one readable column or use a restrained two-column definition list."
    },
    "accessibilityChecks": ["section-heading", "definition-list-semantics", "heading-hierarchy"],
    "neighbors": {
      "before": ["services-icon-grid", "proof-metric-strip"],
      "after": ["newsletter-inline-band", "confirmation-next-actions"]
    },
    "template": {
      "component": "FAQStackedList",
      "source": "templates/compositions/FAQStackedList.jsx",
      "style": "templates/compositions/compositions.module.css"
    },
    "evidence": ["heatwave-fl", "oops-my-phone", "Precision-paint-pros"],
    "stability": "experimental",
    "since": "0.6.0",
    "contractVersion": 1
  },
  {
    "id": "services-icon-grid",
    "title": "Services icon grid",
    "family": "services",
    "description": "A concise service or capability grid with optional icons and per-item actions.",
    "selection": {
      "description": "Use when several offers need equal visual weight and brief explanations.",
      "queries": ["Show services in an icon grid", "Create an equal-weight capability section"],
      "avoidWhen": ["One service is dominant enough to require a featured media treatment."],
      "keywords": ["services", "features", "capabilities", "icon grid", "offerings"]
    },
    "anatomy": [
      { "id": "intro", "label": "Section introduction", "kind": "content", "required": true },
      { "id": "items", "label": "Service cards", "kind": "list", "required": true },
      { "id": "action", "label": "Section action", "kind": "action", "required": false }
    ],
    "components": ["section", "button-link"],
    "client": false,
    "responsive": {
      "compact": "Collapse cards to one column with icons aligned consistently.",
      "wide": "Distribute cards across two to four equal columns."
    },
    "accessibilityChecks": ["section-heading", "list-semantics", "decorative-icon-hidden"],
    "neighbors": {
      "before": ["announcement-dismissible"],
      "after": ["process-numbered-steps", "proof-metric-strip"]
    },
    "template": {
      "component": "ServicesIconGrid",
      "source": "templates/compositions/ServicesIconGrid.jsx",
      "style": "templates/compositions/compositions.module.css"
    },
    "evidence": ["bgr-main", "heatwave-fl", "Precision-paint-pros", "virtuecreation"],
    "stability": "experimental",
    "since": "0.6.0",
    "contractVersion": 1
  },
  {
    "id": "services-media-grid",
    "title": "Services media grid",
    "family": "services",
    "description": "A collection of service summaries paired with project-owned imagery.",
    "selection": {
      "description": "Use when services benefit from visual examples, outcomes, or environmental context.",
      "queries": ["Create image-led service cards", "Show service offerings with media"],
      "avoidWhen": ["Imagery is generic or would distract from a short utility-oriented list."],
      "keywords": ["services", "media", "image cards", "offerings", "capabilities"]
    },
    "anatomy": [
      { "id": "intro", "label": "Section introduction", "kind": "content", "required": true },
      { "id": "media-items", "label": "Media service cards", "kind": "media", "required": true },
      { "id": "actions", "label": "Item actions", "kind": "action", "required": false }
    ],
    "components": ["section", "button-link"],
    "client": false,
    "responsive": {
      "compact": "Stack media above copy and keep cards in a single column.",
      "wide": "Use a balanced two- or three-column collection with consistent media ratios."
    },
    "accessibilityChecks": ["section-heading", "meaningful-image-alt", "link-purpose"],
    "neighbors": {
      "before": ["announcement-dismissible"],
      "after": ["proof-metric-strip", "process-numbered-steps"]
    },
    "template": {
      "component": "ServicesMediaGrid",
      "source": "templates/compositions/ServicesMediaGrid.jsx",
      "style": "templates/compositions/compositions.module.css"
    },
    "evidence": ["heatwave-fl", "oops-my-phone", "Precision-paint-pros", "recinda6ix"],
    "stability": "experimental",
    "since": "0.6.0",
    "contractVersion": 1
  },
  {
    "id": "process-numbered-steps",
    "title": "Process numbered steps",
    "family": "process",
    "description": "A linear sequence that explains how work progresses from first action to outcome.",
    "selection": {
      "description": "Use for short, ordered processes where each step has similar importance and amount of copy.",
      "queries": ["Explain our process in numbered steps", "Create a simple how-it-works section"],
      "avoidWhen": ["The sequence branches, loops, or depends on application state."],
      "keywords": ["process", "steps", "how it works", "numbered", "workflow"]
    },
    "anatomy": [
      { "id": "intro", "label": "Process introduction", "kind": "content", "required": true },
      { "id": "steps", "label": "Ordered steps", "kind": "list", "required": true }
    ],
    "components": ["section"],
    "client": false,
    "responsive": {
      "compact": "Stack steps vertically and preserve their explicit order.",
      "wide": "Arrange steps in a row or restrained grid with visible sequence markers."
    },
    "accessibilityChecks": ["section-heading", "ordered-list-semantics", "sequence-not-color-only"],
    "neighbors": {
      "before": ["services-icon-grid", "services-media-grid"],
      "after": ["proof-metric-strip", "faq-split-accordion"]
    },
    "template": {
      "component": "ProcessNumberedSteps",
      "source": "templates/compositions/ProcessNumberedSteps.jsx",
      "style": "templates/compositions/compositions.module.css"
    },
    "evidence": ["bgr-main", "oops-my-phone", "Precision-paint-pros", "virtuecreation"],
    "stability": "experimental",
    "since": "0.6.0",
    "contractVersion": 1
  },
  {
    "id": "timeline-alternating-media",
    "title": "Timeline alternating media",
    "family": "process",
    "description": "A chronological or narrative sequence with optional media alternating beside each entry.",
    "selection": {
      "description": "Use for histories, journeys, milestones, and longer processes where each stage deserves visual space.",
      "queries": ["Build an alternating timeline", "Tell our journey with milestones and images"],
      "avoidWhen": ["The content is not genuinely sequential or has fewer than three meaningful stages."],
      "keywords": ["timeline", "milestones", "journey", "history", "media"]
    },
    "anatomy": [
      { "id": "intro", "label": "Timeline introduction", "kind": "content", "required": true },
      { "id": "entries", "label": "Timeline entries", "kind": "list", "required": true },
      { "id": "media", "label": "Entry media", "kind": "media", "required": false }
    ],
    "components": ["section"],
    "client": false,
    "responsive": {
      "compact": "Use one chronological column with media before its related copy.",
      "wide": "Alternate media and copy while keeping source order chronological."
    },
    "accessibilityChecks": ["section-heading", "ordered-list-semantics", "source-order-matches-chronology"],
    "neighbors": {
      "before": ["proof-metric-strip", "services-media-grid"],